{
    "position": 1,
    "slug": "admin-screen-review",
    "lesson_slug": "admin-settings",
    "title": "Admin Screen Review",
    "prompt": "Review an admin settings screen proposal for a plugin that stores an API key and sends content to a third-party service. List UX, capability, nonce, privacy, escaping, and i18n requirements.",
    "hints": [
        "Treat secrets, third-party transfer, and operator clarity as first-class requirements."
    ],
    "passing_score": 0.8,
    "expected_output_schema": {
        "type": "object",
        "properties": {
            "summary": {
                "type": "string",
                "description": "One or two sentences explaining the answer."
            },
            "work": {
                "type": "string",
                "description": "The main implementation, review, or design answer."
            },
            "checks": {
                "type": "array",
                "items": {
                    "type": "string"
                },
                "description": "Verification steps, review checks, or acceptance criteria."
            }
        },
        "required": [
            "summary",
            "work",
            "checks"
        ]
    },
    "rubric": {
        "criteria": [
            {
                "name": "Covers the required craft vocabulary",
                "points": 2,
                "required_terms": [
                    "capability",
                    "nonce",
                    "API key",
                    "privacy",
                    "third-party",
                    "escape",
                    "i18n",
                    "Settings API"
                ]
            },
            {
                "name": "Uses WordPress-specific implementation language",
                "points": 1,
                "any_terms": [
                    "WordPress",
                    "plugin",
                    "hook",
                    "REST",
                    "capability",
                    "nonce",
                    "transient",
                    "block.json",
                    "Plugin Check"
                ]
            },
            {
                "name": "Names verification or review work",
                "points": 1,
                "any_terms": [
                    "test",
                    "verify",
                    "review",
                    "PHPCS",
                    "Plugin Check",
                    "php -l",
                    "PHPUnit",
                    "smoke"
                ]
            }
        ]
    }
}
